<?xml version="1.0" encoding="UTF-8"?>
<ParkingData xmlns:xsi="http://www.w3.org/2001/XMLSchema-instance"
             xmlns="http://www.christuniversity.edu/parking"
             xsi:schemaLocation="http://www.christuniversity.edu/parking data.xsd">
    <ParkingSlot>
        <SlotID>1</SlotID>
        <ServiceType>Standard</ServiceType>
        <SlotType>Two-Wheeler</SlotType>
        <Availability>Available</Availability>
        <MonthlyRate>200</MonthlyRate>
        <YearlyRate>800</YearlyRate>
    </ParkingSlot>
    <ParkingSlot>
        <SlotID>2</SlotID>
        <ServiceType>Premium</ServiceType>
        <SlotType>Two-Wheeler</SlotType>
        <Availability>Occupied</Availability>
         <MonthlyRate>500</MonthlyRate>
        <YearlyRate>1200</YearlyRate>
    </ParkingSlot>
    <ParkingSlot>
        <SlotID>3</SlotID>
        <ServiceType>Standard</ServiceType>
        <SlotType>Four-Wheeler</SlotType>
        <Availability>Available</Availability>
        <MonthlyRate>500</MonthlyRate>
        <YearlyRate>1000</YearlyRate>
    </ParkingSlot>
    <ParkingSlot>
        <SlotID>4</SlotID>
        <ServiceType>Premium</ServiceType>
        <SlotType>Four-Wheeler</SlotType>
        <Availability>Available</Availability>
         <MonthlyRate>800</MonthlyRate>
        <YearlyRate>1500</YearlyRate>
    </ParkingSlot>
    <ParkingSlot>
        <SlotID>5</SlotID>
        <ServiceType>Standard</ServiceType>
        <SlotType>Two-Wheeler</SlotType>
        <Availability>Occupied</Availability>
        <MonthlyRate>200</MonthlyRate>
        <YearlyRate>800</YearlyRate>
    </ParkingSlot>
    <ParkingSlot>
        <SlotID>6</SlotID>
        <ServiceType>Premium</ServiceType>
        <SlotType>Four-Wheeler</SlotType>
        <Availability>Available</Availability>
         <MonthlyRate>800</MonthlyRate>
        <YearlyRate>1500</YearlyRate>
    </ParkingSlot>
</ParkingData>
